{
  "schema_version": "claim.v1",
  "claim_id": "dividend_growth_momentum.momentum_rotation",
  "statement": "红利与成长 ETF 动量轮动在每个信号日收盘比较 515180.SH 与 159967.SZ 的跟踪调整收盘收益并持有较强 ETF。这是当前研究采用的核心假设，但尚未形成可验证的晋级证据，仅作为 in-sample 研究诊断。",
  "claim_type": "hypothesis",
  "supports": [
    "evidence://strategy-research/pre_production/dividend_growth_momentum/README.md"
  ],
  "contradicts": [],
  "critical_assumptions": [
    {
      "assumption_id": "momentum_alpha",
      "statement": "红利与成长之间的动量相对强弱可预测未来一期收益。"
    },
    {
      "assumption_id": "next_open_execution",
      "statement": "从下一交易日开盘调仓的成本可被动量收益覆盖。"
    }
  ],
  "invalidation_conditions": [
    {
      "observable": "walk_forward 或 benchmark_matrix 证据",
      "threshold": "未形成 positive 结果即视为假设未验证",
      "horizon": "长窗口晋级证据出具后"
    }
  ],
  "abstain_conditions": [
    {
      "dimension": "证据完备度",
      "reason": "pit、walk_forward、benchmark_matrix、cost 四项全部 missing，结论占位尚未补充，不做有效性判断。"
    }
  ],
  "status": "proposed",
  "last_reviewed": "2026-08-18"
}
