{
  "schema_version": "claim.v1",
  "claim_id": "hotsector.point_in_time_discipline",
  "statement": "热点板块选股当前基于非严格时间点的多臂回顾回执，未启用 PIT 时间点约束，因此其排序能力证据不足以支撑生产级判断。",
  "claim_type": "fact",
  "supports": [
    "evidence://strategy-app/docs/research/evidence/hotsector-numeric-v2-retrospective-receipt-20260717.json"
  ],
  "contradicts": [],
  "critical_assumptions": [
    {
      "assumption_id": "receipt_authoritative",
      "statement": "strategy-app 的多臂回顾回执是 hotsector 证据的权威来源。"
    }
  ],
  "invalidation_conditions": [
    {
      "observable": "启用严格 PIT 后的证据结论",
      "threshold": "与当前非 PIT 结论相反",
      "horizon": "PIT 回测出具后"
    }
  ],
  "abstain_conditions": [
    {
      "dimension": "PIT 约束",
      "reason": "strict_point_in_time=false，无法确认排序是否引入未来函数。"
    },
    {
      "dimension": "成本与样本外",
      "reason": "cost、final_oos、cpcv、regime 均为 pending，缺数据即放弃晋级判断。"
    }
  ],
  "status": "active",
  "last_reviewed": "2026-08-18"
}
