{
  "schema_version": "claim.v1",
  "claim_id": "d11_h5.five_sleeve_constraint",
  "statement": "D11-H5 五袖套影子策略固定为五个互斥子组合、每个子组合 4 只，合并后 20 只等权且单股目标权重 5%，每个交易日只刷新一个子组合。该结构约束是影子跟踪的前提，但七项强制证据全部缺失。",
  "claim_type": "fact",
  "supports": [
    "evidence://strategy-research/strategies/d11_h5_shadow/README.md"
  ],
  "contradicts": [],
  "critical_assumptions": [
    {
      "assumption_id": "sleeve_partition_valid",
      "statement": "五个子组合互斥、不重叠，合并恰为 20 只。"
    },
    {
      "assumption_id": "recovery_semantics",
      "statement": "停机恢复时只按最新完整输入运行一次当前目标，不逐日重复换仓。"
    }
  ],
  "invalidation_conditions": [
    {
      "observable": "子组合重叠或非 5×4",
      "threshold": "合并后不是 20 只或总权重不等于 100%",
      "horizon": "每次发布校验"
    }
  ],
  "abstain_conditions": [
    {
      "dimension": "晋级判断",
      "reason": "产物固定 research_only=true、eligible_for_live=false，且七项证据全部 missing，不做晋级判断。"
    }
  ],
  "status": "active",
  "last_reviewed": "2026-08-18"
}
